tipid,a,b,line
108,Post exploitation Asset Discovery https://github.com/vysec/Invoke-DNSDiscovery looks for assets by name that might be good if youre low priv user.,,Post exploitation Asset Discovery https://github.com/vysec/Invoke-DNSDiscovery looks for assets by name that might be good if youre low priv user.
109,Use Invoke-ProcessScan to give some running processes context on a system. This uses EQGRP leaked list- https://github.com/vysec/Invoke-ProcessScan,,Use Invoke-ProcessScan to give some running processes context on a system. This uses EQGRP leaked list- https://github.com/vysec/Invoke-ProcessScan
110,Mature blue? Be careful and minidump lssas.exe then download it and parse locally,,Mature blue? Be careful and minidump lssas.exe then download it and parse locally
111,Found an exploitable S4U condition? Use Mistique to attack! https://github.com/machosec/Mystique/blob/master/Mystique.ps1,,Found an exploitable S4U condition? Use Mistique to attack! https://github.com/machosec/Mystique/blob/master/Mystique.ps1
112,Need to use VNC as RDP in use? https://github.com/artkond/Invoke-Vnchas been pretty stable for me. Run it then pivot in and connect!,,Need to use VNC as RDP in use? https://github.com/artkond/Invoke-Vnchas been pretty stable for me. Run it then pivot in and connect!
113,Found super secret.doc or master password database.xlsx? Use office2john to get hash and crack in Hashcat!,,Found super secret.doc or master password database.xlsx? Use office2john to get hash and crack in Hashcat!
114,"PowerUp didnt work and you want to autoruns? Dont bother going on disk, use Invoke-AutoRuns to csv- https://github.com/p0w3rsh3ll/AutoRuns",,"PowerUp didnt work and you want to autoruns? Dont bother going on disk, use Invoke-AutoRuns to csv- https://github.com/p0w3rsh3ll/AutoRuns"
115,Need to zip up a directory quickly for easy exfiltration? Eg. Home shares https://github.com/thoemmi/7Zip4Powershell use Powershell,,Need to zip up a directory quickly for easy exfiltration? Eg. Home shares https://github.com/thoemmi/7Zip4Powershell use Powershell
116,Use CatMyFish to search for categorised domains that could be used in your engagements - https://github.com/Mr-Un1k0d3r/CatMyFish,,Use CatMyFish to search for categorised domains that could be used in your engagements - https://github.com/Mr-Un1k0d3r/CatMyFish
117,Ran Invoke-MapDomainTrusts from PowerView? Use @harmj0y DomainTrustExplorer to generate a graph https://github.com/sixdub/DomainTrustExplorer,,Ran Invoke-MapDomainTrusts from PowerView? Use @harmj0y DomainTrustExplorer to generate a graph https://github.com/sixdub/DomainTrustExplorer
118,FOCA finds some useful information for OSINT and intelligence phases. https://www.elevenpaths.com/labstools/foca/index.html,,FOCA finds some useful information for OSINT and intelligence phases. https://www.elevenpaths.com/labstools/foca/index.html
119,GoPhish is a pretty useful tool for spinning up simple phishing campaigns especially for decoys https://getgophish.com,,GoPhish is a pretty useful tool for spinning up simple phishing campaigns especially for decoys https://getgophish.com
120,If you have write access to the orgs shared Office template folders You can privesc by backdooring these trusted documents.,,If you have write access to the orgs shared Office template folders You can privesc by backdooring these trusted documents.
121,@zwned uses netsh packet tracing to sniff natively from victim host. Save capture and analyze offline!,,@zwned uses netsh packet tracing to sniff natively from victim host. Save capture and analyze offline!
122,More decoy tips! Scan the external perimeter with tools like Nessus and OpenVAS. More traffic the better just to burn the blue,,More decoy tips! Scan the external perimeter with tools like Nessus and OpenVAS. More traffic the better just to burn the blue
123,"Read Sean Metcalfa blog http://adsecurity.org/ When AD is used in many environments, it vital to at least know techniques",,"Read Sean Metcalfa blog http://adsecurity.org/ When AD is used in many environments, it vital to at least know techniques"
124,Remember you can generate a golden ticket offline with knowledge of krbtgt and rest offline. Golden ticket gets silver from DC,,Remember you can generate a golden ticket offline with knowledge of krbtgt and rest offline. Golden ticket gets silver from DC
125,Got krbtgt of a child domain? Forest parent trusts you? Use the SID history attack in golden tickets to escalate to Ent Admin,,Got krbtgt of a child domain? Forest parent trusts you? Use the SID history attack in golden tickets to escalate to Ent Admin
126,"You dont necessarily need Domain Admin, if you have an account that has Replicating directory changes rights, dcsync to pull hash using that account.",,"You dont necessarily need Domain Admin, if you have an account that has Replicating directory changes rights, dcsync to pull hash using that account."
127,Planning to use secretsdump.py? :) Try using the DC machine account to authenticate and dump instead of a user! Save hash,,Planning to use secretsdump.py? :) Try using the DC machine account to authenticate and dump instead of a user! Save hash
128,Use machine account hashes to generate silver tickets to a host for persistence. Save machine hash for DC incase krbtgt rotate,,Use machine account hashes to generate silver tickets to a host for persistence. Save machine hash for DC incase krbtgt rotate
129,Use PEAS to query shares and emails if using ActiveSync - https://github.com/mwrlabs/peas,,Use PEAS to query shares and emails if using ActiveSync - https://github.com/mwrlabs/peas
130,(Not red really but useful) Sort IPs,"cat IPs.txt | sort -t . -k1,1 -k2,2 -k3,3 -k4,4 or even `cat IPs.txt | sort -v""","(Not red really but useful) Sort IPs cat IPs.txt | sort -t . -k1,1 -k2,2 -k3,3 -k4,4 or even `cat IPs.txt | sort -v"""
131,Learn AWK and general bash scripting. Processing and merging of data sets speeds up our job for discovery and time keeping.,,Learn AWK and general bash scripting. Processing and merging of data sets speeds up our job for discovery and time keeping.
132,Worth learning to pick locks and the dust can sensor trick if youre going to do some physical. http://www.artofmanliness.com/2014/11/19/how-to-pick-a-lock-pin-tumbler-locks/,,Worth learning to pick locks and the dust can sensor trick if youre going to do some physical. http://www.artofmanliness.com/2014/11/19/how-to-pick-a-lock-pin-tumbler-locks/
133,Grep has an extract flag -o that can be used to extract from a regex. Good for extracting data from massive blobs.,,Grep has an extract flag -o that can be used to extract from a regex. Good for extracting data from massive blobs.
134,"Victims use wireless? Use KARMA attack to force them onto your network. Use eternalblue, domain creds or other vulns to get in. https://github.com/sensepost/mana",,"Victims use wireless? Use KARMA attack to force them onto your network. Use eternalblue, domain creds or other vulns to get in. https://github.com/sensepost/mana"
135,"Phishing pages are usually custom. However its always good to have a stash for decoys. Generic Gmail, Office365?",,"Phishing pages are usually custom. However its always good to have a stash for decoys. Generic Gmail, Office365?"
136,Keep up to date by watching presentations from conferences on YouTube :) Discover useful techniques,,Keep up to date by watching presentations from conferences on YouTube :) Discover useful techniques
137,"If youve exhausted all payload types, try sending a Mac user a python one liner and Win PS 1 liner. Ive had people run it.",,"If youve exhausted all payload types, try sending a Mac user a python one liner and Win PS 1 liner. Ive had people run it."
139,"If you need to get a clean EXE for file drop and exec, try out @midnite_runr Backdoor Factory - https://github.com/secretsquirrel/the-backdoor-factory",,"If you need to get a clean EXE for file drop and exec, try out @midnite_runr Backdoor Factory - https://github.com/secretsquirrel/the-backdoor-factory"
140,If enemy does not use proxy with TLS inspection then you can use https://www.mdsec.co.uk/2017/02/domain-fronting-via-cloudfront-alternate-domains/ to mask your c2 channel further,,If enemy does not use proxy with TLS inspection then you can use https://www.mdsec.co.uk/2017/02/domain-fronting-via-cloudfront-alternate-domains/ to mask your c2 channel further
141,On a Linux box and want to egress from it over a proxy? Use ProxyTunnel to pipe SSH - https://github.com/proxytunnel/proxytunnel,,On a Linux box and want to egress from it over a proxy? Use ProxyTunnel to pipe SSH - https://github.com/proxytunnel/proxytunnel
142,Need some OSINT? Keep Spiderfoot running long term to accompany your manual OSINT sources http://www.spiderfoot.net,,Need some OSINT? Keep Spiderfoot running long term to accompany your manual OSINT sources http://www.spiderfoot.net
143,OSINTing? TheHarvester does a decent job at subdomains. Though theres better ways to get emails bulk. https://github.com/laramies/theHarvester,,OSINTing? TheHarvester does a decent job at subdomains. Though theres better ways to get emails bulk. https://github.com/laramies/theHarvester
144,Exploring and want to use WMI? https://www.microsoft.com/en-us/download/details.aspx?id=8572 is pretty useful for exploring the different namespaces and classes.,,Exploring and want to use WMI? https://www.microsoft.com/en-us/download/details.aspx?id=8572 is pretty useful for exploring the different namespaces and classes.
145,Need to reset a password? Do it then quickly dcsync for previous password hash and use NTLMinject - https://github.com/vletoux/NTLMInjector,,Need to reset a password? Do it then quickly dcsync for previous password hash and use NTLMinject - https://github.com/vletoux/NTLMInjector
146,"IDS flagging known payload binary blob? Base64 encode it in your payload and use certutil, PS or VB to decode it!",,"IDS flagging known payload binary blob? Base64 encode it in your payload and use certutil, PS or VB to decode it!"
147,Test your phishing campaigns before sending!!!,,Test your phishing campaigns before sending!!!
148,"If youre sending into Exchange, make sure your SMTP server is not in SPAM list or black lists. Check junk mails mail headers",,"If youre sending into Exchange, make sure your SMTP server is not in SPAM list or black lists. Check junk mails mail headers"
149,Use Microsofts Message Header Analyzer to parse and review email headers from Outlook. https://testconnectivity.microsoft.com/MHA/Pages/mha.aspx,,Use Microsofts Message Header Analyzer to parse and review email headers from Outlook. https://testconnectivity.microsoft.com/MHA/Pages/mha.aspx
150,Make sure phishing emails Bounce header matches From. Or else some will flag as malicious.,,Make sure phishing emails Bounce header matches From. Or else some will flag as malicious.
151,DomainHunter also looks for good candidate expired domains - https://github.com/minisllc/domainhunter,,DomainHunter also looks for good candidate expired domains - https://github.com/minisllc/domainhunter
152,Want to scrape MetaData in CLI? Use PowerMeta. Linux users can use PowerShell too! https://github.com/dafthack/PowerMeta,,Want to scrape MetaData in CLI? Use PowerMeta. Linux users can use PowerShell too! https://github.com/dafthack/PowerMeta
153,RDP in use? Dont want to use VNC? Try mimikatzs ts::multirdp in memory patch by @gentilkiwi,,RDP in use? Dont want to use VNC? Try mimikatzs ts::multirdp in memory patch by @gentilkiwi
154,Admin on a machine with VPN client? certificate extraction using Mimikatz by @gentilkiwi. Dont forget to dl configs. Backdoor,,Admin on a machine with VPN client? certificate extraction using Mimikatz by @gentilkiwi. Dont forget to dl configs. Backdoor
155,"Master all the quick wins to Domain privilege escalation. When youre pressured to get DA in 15 mins, you want to know you can",,"Master all the quick wins to Domain privilege escalation. When youre pressured to get DA in 15 mins, you want to know you can"
156,@Akijos notes that we should be careful when using silver tickets with scheduled tasks. Author is the user account youre on.,,@Akijos notes that we should be careful when using silver tickets with scheduled tasks. Author is the user account youre on.
157,"If you dont need a golden ticket, dont generate it.",,"If you dont need a golden ticket, dont generate it."
158,"Scan a DNS server for Alexa top 1 million spoofable domains :) Ive got a massive list, do you?",,"Scan a DNS server for Alexa top 1 million spoofable domains :) Ive got a massive list, do you?"
159,Scan the internet for a list of domain frontable domains! Ive got a big big list ready for whenever I want to use them :),,Scan the internet for a list of domain frontable domains! Ive got a big big list ready for whenever I want to use them :)
160,We all know people share credentials between different services. Try these credentials on other accounts owned by the user!,,We all know people share credentials between different services. Try these credentials on other accounts owned by the user!
161,Cant crack a password? Try the users previous passwords from history in AD. They may follow a pattern.,,Cant crack a password? Try the users previous passwords from history in AD. They may follow a pattern.
162,Cant crack a hash owned by a user? Take all previously discovered passwords from their files and generate a new word list.,,Cant crack a hash owned by a user? Take all previously discovered passwords from their files and generate a new word list.
163,Cant crack a password? Make sure these are in your word list,"name of company, town, capital, country, months! Appear a lot.","Cant crack a password? Make sure these are in your word list name of company, town, capital, country, months! Appear a lot."
164,Didier Stevens has SelectMyParent tool that lets you spawn a child process with an arbitrary parent. https://blog.didierstevens.com/2017/03/20/that-is-not-my-child-process/,,Didier Stevens has SelectMyParent tool that lets you spawn a child process with an arbitrary parent. https://blog.didierstevens.com/2017/03/20/that-is-not-my-child-process/
165,Using SelectMyParent stops those detections eg. powershell.exe spawning cmd.exe. @armitagehackers CobaltStrike has ppid cmd!,,Using SelectMyParent stops those detections eg. powershell.exe spawning cmd.exe. @armitagehackers CobaltStrike has ppid cmd!
166,Use PowerPoint mouse over text to invoke a powershell command one liner. #adversarysimulation - https://www.dodgethissecurity.com/2017/06/02/new-powerpoint-mouseover-based-downloader-analysis-results/,,Use PowerPoint mouse over text to invoke a powershell command one liner. #adversarysimulation - https://www.dodgethissecurity.com/2017/06/02/new-powerpoint-mouseover-based-downloader-analysis-results/
167,Follow @mattifestation to keep up to date with blue team advances. Just in case blue is actually up to date with mitigations!,,Follow @mattifestation to keep up to date with blue team advances. Just in case blue is actually up to date with mitigations!
168,Using VBS or JS? Cant stage using PowerShell.exe as blocked? @Cneelis released https://github.com/Cn33liz/StarFighters so you can keep use PS,,Using VBS or JS? Cant stage using PowerShell.exe as blocked? @Cneelis released https://github.com/Cn33liz/StarFighters so you can keep use PS
169,Not sure who uses Wi-Fi webcams but go run a mass deauth attack if youre going to plan on breaking in physically to discon,,Not sure who uses Wi-Fi webcams but go run a mass deauth attack if youre going to plan on breaking in physically to discon
170,@malcomvetter Never use defaults - run Mimikatz with AES and 8 hour tickets to avoid passive detection from NG defense tools!,,@malcomvetter Never use defaults - run Mimikatz with AES and 8 hour tickets to avoid passive detection from NG defense tools!
171,Win XP doesnt have PowerShell? Try using Unmanaged powershell to keep using your favourite scripts!,,Win XP doesnt have PowerShell? Try using Unmanaged powershell to keep using your favourite scripts!
172,@anthonykasza tells us that the at.exe command takes base64 encoded Params! Eg. at.exe b64::[encoded params],,@anthonykasza tells us that the at.exe command takes base64 encoded Params! Eg. at.exe b64::[encoded params]
173,Grab cleartext wireless keys,"netsh wlan show profile name=""ssid"" key=clear","Grab cleartext wireless keys netsh wlan show profile name=""ssid"" key=clear"
174,Got a shell on a victim without admin? Want their creds? Try Inveigh then rpcping -s 127.0.0.1 -t ncacn_np to leak hash.,,Got a shell on a victim without admin? Want their creds? Try Inveigh then rpcping -s 127.0.0.1 -t ncacn_np to leak hash.
175,Got a low priv shell and need creds? Use Invoke-LoginPrompt by @enigma0x3 https://raw.githubusercontent.com/enigma0x3/Invoke-LoginPrompt/master/Invoke-LoginPrompt.ps1,,Got a low priv shell and need creds? Use Invoke-LoginPrompt by @enigma0x3 https://raw.githubusercontent.com/enigma0x3/Invoke-LoginPrompt/master/Invoke-LoginPrompt.ps1
176,"Get access to shadow admin accounts, they can DCsync and are essentially DA. https://www.cyberark.com/threat-research-blog/shadow-admins-stealthy-accounts-fear/",,"Get access to shadow admin accounts, they can DCsync and are essentially DA. https://www.cyberark.com/threat-research-blog/shadow-admins-stealthy-accounts-fear/"
177,If blue detects PTH. Try extract Kerberos tickets and PTT.,,If blue detects PTH. Try extract Kerberos tickets and PTT.
178,@lefterispan wrote https://gist.github.com/leftp/a3330f13ac55f584239baa68a3bb88f2 â€¦ which sets up a proxy and forces an auth attempt to it to leak hash. Low priv leak.,,@lefterispan wrote https://gist.github.com/leftp/a3330f13ac55f584239baa68a3bb88f2 â€¦ which sets up a proxy and forces an auth attempt to it to leak hash. Low priv leak.
179,"When creating phishing pages, try cloning and modifying parts of the client's own webpages. For example of their VPN login!",,"When creating phishing pages, try cloning and modifying parts of the client's own webpages. For example of their VPN login!"
180,Regardless of whether there are known defences. Run your PS scripts through Obfuscation before loading into memory.,,Regardless of whether there are known defences. Run your PS scripts through Obfuscation before loading into memory.
181,Stuck trying to find those assets still? Try @424f424f Get-BrowserData https://github.com/rvrsh3ll/Misc-Powershell-Scripts/blob/master/Get-BrowserData.ps1,,Stuck trying to find those assets still? Try @424f424f Get-BrowserData https://github.com/rvrsh3ll/Misc-Powershell-Scripts/blob/master/Get-BrowserData.ps1
182,Follow @JohnLaTwC as he tweets phishing examples and sometimes with new techniques used in Wild. Good for adversary simulation,,Follow @JohnLaTwC as he tweets phishing examples and sometimes with new techniques used in Wild. Good for adversary simulation
183,@MrUn1k0d3r released https://github.com/Mr-Un1k0d3r/SCT-obfuscator â€¦ can probably bypass Gateway signatures when performing SCT delivery for regsvr32! https://github.com/Mr-Un1k0d3r/SCT-obfuscator,,@MrUn1k0d3r released https://github.com/Mr-Un1k0d3r/SCT-obfuscator â€¦ can probably bypass Gateway signatures when performing SCT delivery for regsvr32! https://github.com/Mr-Un1k0d3r/SCT-obfuscator
184,We always talk about Windows and AD. But now let's have a look at Linux and AD with https://medium.com/@br4nsh/from-linux-to-ad-10efb529fae9,,We always talk about Windows and AD. But now let's have a look at Linux and AD with https://medium.com/@br4nsh/from-linux-to-ad-10efb529fae9
185,Use WSUS for lateral movement https://github.com/AlsidOfficial/WSUSpendu/blob/master/WSUSpendu.ps1,,Use WSUS for lateral movement https://github.com/AlsidOfficial/WSUSpendu/blob/master/WSUSpendu.ps1
186,View @jpcert https://www.jpcert.or.jp/english/pub/sr/20170612ac-ir_research_en.pdf â€¦ and look at all those indicators and artefacts left behind. Then hexedit those tools ?,,View @jpcert https://www.jpcert.or.jp/english/pub/sr/20170612ac-ir_research_en.pdf â€¦ and look at all those indicators and artefacts left behind. Then hexedit those tools ?
187,Found a portal using 2FA? Using RSA SecureID? https://blog.netspi.com/targeting-rsa-emergency-access-tokencodes-fun-profit/ â€¦ Pin bruteforce!,,Found a portal using 2FA? Using RSA SecureID? https://blog.netspi.com/targeting-rsa-emergency-access-tokencodes-fun-profit/ â€¦ Pin bruteforce!
188,@pwnagelabs says to avoid bash history on exit using,kill -9 $$,@pwnagelabs says to avoid bash history on exit using kill -9 $$
189,@pwnagelabs teaches us how to avoid wtmp logging with,ssh -l user target -T,@pwnagelabs teaches us how to avoid wtmp logging with ssh -l user target -T
190,@bluscreenofjeff shows us how to use Apache Mod rewrite to randomly serve different payloads https://bluescreenofjeff.com/2017-06-13-serving-random-payloads-with-apache-mod_rewrite/,,@bluscreenofjeff shows us how to use Apache Mod rewrite to randomly serve different payloads https://bluescreenofjeff.com/2017-06-13-serving-random-payloads-with-apache-mod_rewrite/
191,"Domain user? Query LDAP for Printers. Attempt default creds or known vulns then read Service account creds, hash or relay",,"Domain user? Query LDAP for Printers. Attempt default creds or known vulns then read Service account creds, hash or relay"
192,Get-WmiObject -Class MicrosoftDNS_AType -NameSpace Root\MicrosoftDNS -ComputerName DC001 | Export-CSV -not dns.csv,,Get-WmiObject -Class MicrosoftDNS_AType -NameSpace Root\MicrosoftDNS -ComputerName DC001 | Export-CSV -not dns.csv
193,Password protected doc in email? For some reason a lot of people send the password separately to the same inbox. #epicfail,,Password protected doc in email? For some reason a lot of people send the password separately to the same inbox. #epicfail
194,Can't see another part of the network and there's a DC? Pivot off the DC :),,Can't see another part of the network and there's a DC? Pivot off the DC :)
195,C:\windows\system32\inetsrv\appcmd list site to find IIS bindings.,,C:\windows\system32\inetsrv\appcmd list site to find IIS bindings.
196,DA -> Locate DB -> Found MSSQL? https://github.com/NetSPI/PowerUpSQL use PowerUpSQL to enumerate and privesc by stealing tokens.,,DA -> Locate DB -> Found MSSQL? https://github.com/NetSPI/PowerUpSQL use PowerUpSQL to enumerate and privesc by stealing tokens.
197,"If ACL doesn't let you read other users' home shares, you can try net view \\fileserv /all to try other shares and folders!",,"If ACL doesn't let you read other users' home shares, you can try net view \\fileserv /all to try other shares and folders!"
198,Username jondoe and jondoe-x? Ones an Admin? Try same password. May be shared ? repeat for entire user list.,,Username jondoe and jondoe-x? Ones an Admin? Try same password. May be shared ? repeat for entire user list.
199,Failed to phish? Payloads failing? Mac users? Write an email and ask them to open terminal and paste in python Empyre one line,,Failed to phish? Payloads failing? Mac users? Write an email and ask them to open terminal and paste in python Empyre one line
200,@_wald0 blessed us with this BH cypher query to skip specific nodes to look for other paths. https://pastebin.com/qAzH9uji,,@_wald0 blessed us with this BH cypher query to skip specific nodes to look for other paths. https://pastebin.com/qAzH9uji
201,@424f424f pushed some research into LNK files inside CAB can be used to bypass the Attachment Manager ?http://www.rvrsh3ll.net/blog/informational/bypassing-windows-attachment-manager/,,@424f424f pushed some research into LNK files inside CAB can be used to bypass the Attachment Manager ?http://www.rvrsh3ll.net/blog/informational/bypassing-windows-attachment-manager/
202,"When domain fronting, your calls hit the edge node, so every domain you use potentially hits a different a IP! ?",,"When domain fronting, your calls hit the edge node, so every domain you use potentially hits a different a IP! ?"
203,"If using @Cneelis StarFighter. Instead of using a staged web delivery, just stick while stageless payload as encoded block in!",,"If using @Cneelis StarFighter. Instead of using a staged web delivery, just stick while stageless payload as encoded block in!"
204,Printers are often good MAC addresses to use to beat NAC when physical red teaming as printers (mostly?) don't support 802.1x,,Printers are often good MAC addresses to use to beat NAC when physical red teaming as printers (mostly?) don't support 802.1x
205,"If proxy is blocking SCT file, replace <scriptlet> with <package> and add <component id=""test""> around the rest. Thx @subTee",,"If proxy is blocking SCT file, replace <scriptlet> with <package> and add <component id=""test""> around the rest. Thx @subTee"
206,CobaltStrike's @armitagehacker VNC not working? Here's a workaround using @artkond Invoke-VNC https://github.com/vysec/Aggressor-VYSEC/blob/master/vnc-psh.cna,,CobaltStrike's @armitagehacker VNC not working? Here's a workaround using @artkond Invoke-VNC https://github.com/vysec/Aggressor-VYSEC/blob/master/vnc-psh.cna
207,Got C2 on Windows user but no credentials? Leak a hash using @leftp's code. Implemented into CNA https://github.com/vysec/Aggressor-VYSEC/blob/master/Invoke-CredLeak.ps1,,Got C2 on Windows user but no credentials? Leak a hash using @leftp's code. Implemented into CNA https://github.com/vysec/Aggressor-VYSEC/blob/master/Invoke-CredLeak.ps1
208,@Nebulator spoke on IP regex by IR at #SnoopCon. Here's CobaltStrike @armitagehacker CNA to automate https://github.com/vysec/Aggressor-VYSEC/blob/master/ping.cna,,@Nebulator spoke on IP regex by IR at #SnoopCon. Here's CobaltStrike @armitagehacker CNA to automate https://github.com/vysec/Aggressor-VYSEC/blob/master/ping.cna
